[
  {
    "id": "dashboard.support.activity.loading-tsx",
    "title": "Loading (Activity)",
    "kind": "support_surface",
    "routePath": "/activity",
    "owner": {
      "pageModule": "src/app/activity/loading.tsx",
      "featureModule": "@/features/history/history-console"
    },
    "navigation": {
      "inPrimaryNavigation": true,
      "family": "history",
      "label": "Activity",
      "primary": false,
      "mobile": true
    },
    "sourceFiles": {
      "primary": "src/app/activity/loading.tsx",
      "supporting": []
    },
    "coverage": {
      "coverageStatus": "covered-automated",
      "localChecks": [
        "projects/dashboard/src/app/support-surfaces.test.tsx"
      ],
      "liveChecks": [],
      "primaryControls": [
        "support surface render"
      ]
    },
    "completionStatus": "live_complete",
    "notes": [
      "Support surface discovered from route-local app file census.",
      "Covered by the dedicated support-surface render harness."
    ]
  },
  {
    "id": "dashboard.support.agents.loading-tsx",
    "title": "Loading (Agents)",
    "kind": "support_surface",
    "routePath": "/agents",
    "owner": {
      "pageModule": "src/app/agents/loading.tsx",
      "featureModule": "@/features/agents/agent-console"
    },
    "navigation": {
      "inPrimaryNavigation": true,
      "family": "core",
      "label": "Agent Console",
      "primary": true,
      "mobile": true
    },
    "sourceFiles": {
      "primary": "src/app/agents/loading.tsx",
      "supporting": []
    },
    "coverage": {
      "coverageStatus": "covered-automated",
      "localChecks": [
        "projects/dashboard/src/app/support-surfaces.test.tsx"
      ],
      "liveChecks": [],
      "primaryControls": [
        "support surface render"
      ]
    },
    "completionStatus": "live_complete",
    "notes": [
      "Support surface discovered from route-local app file census.",
      "Covered by the dedicated support-surface render harness."
    ]
  },
  {
    "id": "dashboard.support.chat.loading-tsx",
    "title": "Loading (Chat)",
    "kind": "support_surface",
    "routePath": "/chat",
    "owner": {
      "pageModule": "src/app/chat/loading.tsx",
      "featureModule": "@/features/chat/direct-chat-console"
    },
    "navigation": {
      "inPrimaryNavigation": true,
      "family": "core",
      "label": "Direct Chat",
      "primary": true,
      "mobile": true
    },
    "sourceFiles": {
      "primary": "src/app/chat/loading.tsx",
      "supporting": []
    },
    "coverage": {
      "coverageStatus": "covered-automated",
      "localChecks": [
        "projects/dashboard/src/app/support-surfaces.test.tsx"
      ],
      "liveChecks": [],
      "primaryControls": [
        "support surface render"
      ]
    },
    "completionStatus": "live_complete",
    "notes": [
      "Support surface discovered from route-local app file census.",
      "Covered by the dedicated support-surface render harness."
    ]
  },
  {
    "id": "dashboard.support.conversations.loading-tsx",
    "title": "Loading (Conversations)",
    "kind": "support_surface",
    "routePath": "/conversations",
    "owner": {
      "pageModule": "src/app/conversations/loading.tsx",
      "featureModule": "@/features/history/history-console"
    },
    "navigation": {
      "inPrimaryNavigation": true,
      "family": "history",
      "label": "Conversations",
      "primary": false,
      "mobile": true
    },
    "sourceFiles": {
      "primary": "src/app/conversations/loading.tsx",
      "supporting": []
    },
    "coverage": {
      "coverageStatus": "covered-automated",
      "localChecks": [
        "projects/dashboard/src/app/support-surfaces.test.tsx"
      ],
      "liveChecks": [],
      "primaryControls": [
        "support surface render"
      ]
    },
    "completionStatus": "live_complete",
    "notes": [
      "Support surface discovered from route-local app file census.",
      "Covered by the dedicated support-surface render harness."
    ]
  },
  {
    "id": "dashboard.support.gallery.loading-tsx",
    "title": "Loading (Gallery)",
    "kind": "support_surface",
    "routePath": "/gallery",
    "owner": {
      "pageModule": "src/app/gallery/loading.tsx",
      "featureModule": "@/features/gallery/gallery-console"
    },
    "navigation": {
      "inPrimaryNavigation": true,
      "family": "domains",
      "label": "Gallery",
      "primary": false,
      "mobile": true
    },
    "sourceFiles": {
      "primary": "src/app/gallery/loading.tsx",
      "supporting": []
    },
    "coverage": {
      "coverageStatus": "covered-automated",
      "localChecks": [
        "projects/dashboard/src/app/support-surfaces.test.tsx"
      ],
      "liveChecks": [],
      "primaryControls": [
        "support surface render"
      ]
    },
    "completionStatus": "live_complete",
    "notes": [
      "Support surface discovered from route-local app file census.",
      "Covered by the dedicated support-surface render harness."
    ]
  },
  {
    "id": "dashboard.support.goals.loading-tsx",
    "title": "Loading (Goals)",
    "kind": "support_surface",
    "routePath": "/goals",
    "owner": {
      "pageModule": "src/app/goals/loading.tsx",
      "featureModule": "@/features/workforce/goals-console"
    },
    "navigation": {
      "inPrimaryNavigation": true,
      "family": "workforce",
      "label": "Goals",
      "primary": false,
      "mobile": true
    },
    "sourceFiles": {
      "primary": "src/app/goals/loading.tsx",
      "supporting": []
    },
    "coverage": {
      "coverageStatus": "covered-automated",
      "localChecks": [
        "projects/dashboard/src/app/support-surfaces.test.tsx"
      ],
      "liveChecks": [],
      "primaryControls": [
        "support surface render"
      ]
    },
    "completionStatus": "live_complete",
    "notes": [
      "Support surface discovered from route-local app file census.",
      "Covered by the dedicated support-surface render harness."
    ]
  },
  {
    "id": "dashboard.support.gpu.loading-tsx",
    "title": "Loading (Gpu)",
    "kind": "support_surface",
    "routePath": "/gpu",
    "owner": {
      "pageModule": "src/app/gpu/loading.tsx",
      "featureModule": "@/features/gpu/gpu-console"
    },
    "navigation": {
      "inPrimaryNavigation": true,
      "family": "core",
      "label": "GPU Metrics",
      "primary": true,
      "mobile": true
    },
    "sourceFiles": {
      "primary": "src/app/gpu/loading.tsx",
      "supporting": []
    },
    "coverage": {
      "coverageStatus": "covered-automated",
      "localChecks": [
        "projects/dashboard/src/app/support-surfaces.test.tsx"
      ],
      "liveChecks": [],
      "primaryControls": [
        "support surface render"
      ]
    },
    "completionStatus": "live_complete",
    "notes": [
      "Support surface discovered from route-local app file census.",
      "Covered by the dedicated support-surface render harness."
    ]
  },
  {
    "id": "dashboard.support.home.loading-tsx",
    "title": "Loading (Home)",
    "kind": "support_surface",
    "routePath": "/home",
    "owner": {
      "pageModule": "src/app/home/loading.tsx",
      "featureModule": "@/features/home/home-console"
    },
    "navigation": {
      "inPrimaryNavigation": true,
      "family": "domains",
      "label": "Home",
      "primary": false,
      "mobile": true
    },
    "sourceFiles": {
      "primary": "src/app/home/loading.tsx",
      "supporting": []
    },
    "coverage": {
      "coverageStatus": "covered-automated",
      "localChecks": [
        "projects/dashboard/src/app/support-surfaces.test.tsx"
      ],
      "liveChecks": [],
      "primaryControls": [
        "support surface render"
      ]
    },
    "completionStatus": "live_complete",
    "notes": [
      "Support surface discovered from route-local app file census.",
      "Covered by the dedicated support-surface render harness."
    ]
  },
  {
    "id": "dashboard.support.insights.loading-tsx",
    "title": "Loading (Insights)",
    "kind": "support_surface",
    "routePath": "/insights",
    "owner": {
      "pageModule": "src/app/insights/loading.tsx",
      "featureModule": "@/features/intelligence/intelligence-console"
    },
    "navigation": {
      "inPrimaryNavigation": true,
      "family": "intelligence",
      "label": "Insights",
      "primary": false,
      "mobile": true
    },
    "sourceFiles": {
      "primary": "src/app/insights/loading.tsx",
      "supporting": []
    },
    "coverage": {
      "coverageStatus": "covered-automated",
      "localChecks": [
        "projects/dashboard/src/app/support-surfaces.test.tsx"
      ],
      "liveChecks": [],
      "primaryControls": [
        "support surface render"
      ]
    },
    "completionStatus": "live_complete",
    "notes": [
      "Support surface discovered from route-local app file census.",
      "Covered by the dedicated support-surface render harness."
    ]
  },
  {
    "id": "dashboard.support.learning.loading-tsx",
    "title": "Loading (Learning)",
    "kind": "support_surface",
    "routePath": "/learning",
    "owner": {
      "pageModule": "src/app/learning/loading.tsx",
      "featureModule": "@/features/intelligence/intelligence-console"
    },
    "navigation": {
      "inPrimaryNavigation": true,
      "family": "intelligence",
      "label": "Learning",
      "primary": false,
      "mobile": true
    },
    "sourceFiles": {
      "primary": "src/app/learning/loading.tsx",
      "supporting": []
    },
    "coverage": {
      "coverageStatus": "covered-automated",
      "localChecks": [
        "projects/dashboard/src/app/support-surfaces.test.tsx"
      ],
      "liveChecks": [],
      "primaryControls": [
        "support surface render"
      ]
    },
    "completionStatus": "live_complete",
    "notes": [
      "Support surface discovered from route-local app file census.",
      "Covered by the dedicated support-surface render harness."
    ]